{
  "schema_version": 1,
  "catalog_version": "0.5.0",
  "catalog_schema": "catalog/schemas/catalog.schema.json",
  "recipe_schema": "catalog/schemas/recipe.schema.json",
  "supported_recipe_schema_versions": [
    2
  ],
  "default_discovery_limit": 10,
  "taxonomy": {
    "domains": [
      "authority",
      "competition",
      "content",
      "keyword",
      "page",
      "technical",
      "visibility"
    ],
    "operations": [
      "audit",
      "compare",
      "diagnose",
      "discover",
      "map",
      "plan",
      "prioritize",
      "validate",
      "verify"
    ],
    "targets": [
      "brand",
      "competitor-set",
      "content-handoff",
      "link-prospect-set",
      "page",
      "query-set",
      "site"
    ],
    "evidence_units": [
      "channel",
      "claim-set",
      "context-record",
      "document",
      "domain",
      "page",
      "query"
    ]
  },
  "capabilities": [
    "authority-metrics",
    "backlink-sets",
    "brand-representation-chatgpt",
    "brand-representation-gemini",
    "brand-representation-perplexity",
    "canonical-content-document",
    "competitor-discovery",
    "competitor-domains",
    "content-context",
    "content-helpfulness-analysis",
    "content-publication",
    "content-readability-analysis",
    "content-seo-analysis",
    "factual-claim-verification",
    "first-party-performance-data",
    "first-party-search-data",
    "keyword-expansion",
    "keyword-metrics",
    "page-content",
    "page-metadata",
    "page-technical-signals",
    "rendered-page-content",
    "serp-results"
  ],
  "result_contracts": {
    "ai-brand-representation-snapshot/v1": "catalog/schemas/ai-brand-representation-snapshot.v1.schema.json",
    "content-question-review/v1": "catalog/schemas/content-question-review.v1.schema.json",
    "seo-diagnostic/v1": "catalog/schemas/seo-diagnostic.v1.schema.json",
    "seo-implementation-handoff/v1": "catalog/schemas/seo-implementation-handoff.v1.schema.json",
    "seo-opportunity-set/v1": "catalog/schemas/seo-opportunity-set.v1.schema.json"
  }
}
